{
  "$schema": "https://json-schema.org/draft/2020-12/schema",
  "$id": "https://database.tengokukk.com/schemas/document/public-edit-intake.schema.json",
  "title": "Public Edit Intake",
  "description": "Structured write intake from public projection surfaces such as MyBlog. Intake may create annotations or reviewed graph edit operations, but never directly mutates canonical graph truth.",
  "type": "object",
  "additionalProperties": false,
  "required": [
    "schemaVersion",
    "intakeId",
    "sourceSurface",
    "actor",
    "graphId",
    "graphVersionId",
    "packageId",
    "intakeClass",
    "target",
    "payload",
    "reviewPolicy",
    "createdAt"
  ],
  "properties": {
    "schemaVersion": { "type": "string", "const": "public-edit-intake.v1" },
    "intakeId": { "$ref": "#/$defs/stableId" },
    "sourceSurface": { "$ref": "#/$defs/sourceSurface" },
    "actor": { "$ref": "#/$defs/actor" },
    "graphId": { "$ref": "#/$defs/stableId" },
    "graphVersionId": { "$ref": "#/$defs/stableId" },
    "packageId": { "$ref": "#/$defs/stableId" },
    "intakeClass": {
      "type": "string",
      "enum": ["interaction", "annotation", "edit_proposal", "moderation"]
    },
    "target": { "$ref": "#/$defs/target" },
    "payload": { "$ref": "#/$defs/payload" },
    "clientContext": { "$ref": "#/$defs/clientContext" },
    "reviewPolicy": { "$ref": "#/$defs/reviewPolicy" },
    "createdAt": { "type": "string", "format": "date-time" },
    "status": {
      "type": "string",
      "enum": ["submitted", "accepted", "needs_rebase", "needs_review", "rejected", "archived"],
      "default": "submitted"
    },
    "result": { "$ref": "#/$defs/result" }
  },
  "$defs": {
    "stableId": {
      "type": "string",
      "minLength": 1,
      "pattern": "^[A-Za-z0-9][A-Za-z0-9._:-]*$"
    },
    "sourceSurface": {
      "type": "object",
      "additionalProperties": false,
      "required": ["repo", "surface", "projectionType"],
      "properties": {
        "repo": { "type": "string", "minLength": 1 },
        "surface": { "type": "string", "enum": ["myblog", "reader_runtime", "admin_preview", "external_embed"] },
        "route": { "type": "string" },
        "projectionType": { "type": "string", "enum": ["html", "mdx", "astro", "epub", "pdf", "fanqie", "search", "reader_runtime"] },
        "buildId": { "type": "string" }
      }
    },
    "actor": {
      "type": "object",
      "additionalProperties": false,
      "required": ["id", "type"],
      "properties": {
        "id": { "$ref": "#/$defs/stableId" },
        "type": { "type": "string", "enum": ["owner", "authenticated_user", "anonymous_user", "ai", "system"] },
        "displayName": { "type": "string" },
        "authContext": { "type": "object", "additionalProperties": true }
      }
    },
    "target": {
      "type": "object",
      "additionalProperties": false,
      "required": ["targetType", "targetId"],
      "properties": {
        "targetType": { "type": "string", "enum": ["document", "section", "block", "inline", "anchor", "asset", "projection"] },
        "targetId": { "$ref": "#/$defs/stableId" },
        "anchorId": { "$ref": "#/$defs/stableId" },
        "selector": { "type": "object", "additionalProperties": true }
      }
    },
    "payload": {
      "type": "object",
      "additionalProperties": false,
      "required": ["intent"],
      "properties": {
        "intent": {
          "type": "string",
          "enum": [
            "comment",
            "reply",
            "highlight",
            "private_note",
            "correction",
            "rewrite_block",
            "insert_asset_block",
            "replace_asset",
            "update_caption",
            "reorder_section",
            "moderate",
            "reaction",
            "bookmark"
          ]
        },
        "text": { "type": "string" },
        "richText": { "type": "object", "additionalProperties": true },
        "proposedPatch": { "type": "object", "additionalProperties": true },
        "assetRefs": {
          "type": "array",
          "items": { "$ref": "#/$defs/assetRef" },
          "default": []
        },
        "visibility": { "type": "string", "enum": ["private", "public", "editorial", "shared"] },
        "moderationAction": { "type": "string", "enum": ["hide", "show", "pin", "unpin", "resolve", "archive", "report"] },
        "reason": { "type": "string" }
      }
    },
    "assetRef": {
      "type": "object",
      "additionalProperties": false,
      "required": ["assetId"],
      "properties": {
        "assetId": { "$ref": "#/$defs/stableId" },
        "rawArtifactId": { "$ref": "#/$defs/stableId" },
        "role": { "type": "string", "enum": ["illustration", "cover", "figure", "inline_image", "evidence", "replacement"] }
      }
    },
    "clientContext": {
      "type": "object",
      "additionalProperties": false,
      "properties": {
        "locator": { "type": "object", "additionalProperties": true },
        "selectedText": { "type": "string" },
        "userAgent": { "type": "string" },
        "viewport": { "type": "object", "additionalProperties": true },
        "locale": { "type": "string" }
      }
    },
    "reviewPolicy": {
      "type": "object",
      "additionalProperties": false,
      "required": ["required"],
      "properties": {
        "required": { "type": "boolean" },
        "reason": { "type": "string" },
        "allowedResultTypes": {
          "type": "array",
          "items": { "type": "string", "enum": ["annotation", "graph_edit_operation", "runtime_state", "moderation_state", "none"] },
          "default": []
        }
      }
    },
    "result": {
      "type": "object",
      "additionalProperties": false,
      "properties": {
        "annotationId": { "$ref": "#/$defs/stableId" },
        "operationId": { "$ref": "#/$defs/stableId" },
        "newGraphVersionId": { "$ref": "#/$defs/stableId" },
        "readerStateId": { "$ref": "#/$defs/stableId" },
        "notes": { "type": "string" }
      }
    }
  }
}